{
  "$schema": "http://json-schema.org/draft-06/schema",
  "type": "object",
  "properties": {
    "version": {
      "type": "number"
    },
    "success": {
      "type": "boolean"
    },
    "reason": {},
    "content": {
      "type": "boolean"
    },
    "raw": {},
    "inputs": {
      "type": "object",
      "properties": {
        "mcafee_epo_product_id": {
          "type": "string"
        },
        "mcafee_epo_group_id": {
          "type": "integer"
        },
        "mcafee_epo_object_id": {
          "type": "integer"
        }
      }
    },
    "metrics": {
      "type": "object",
      "properties": {
        "version": {
          "type": "string"
        },
        "package": {
          "type": "string"
        },
        "package_version": {
          "type": "string"
        },
        "host": {
          "type": "string"
        },
        "execution_time_ms": {
          "type": "integer"
        },
        "timestamp": {
          "type": "string"
        }
      }
    }
  }
}