{
  "version": 2.0,
  "success": true,
  "reason": null,
  "content": true,
  "raw": null,
  "inputs": {
    "mcafee_epo_push_agent_install_path": null,
    "mcafee_epo_push_agent_package_path": null,
    "mcafee_epo_push_agent_force_install": false,
    "mcafee_epo_group_id": 2,
    "mcafee_epo_push_agent": false,
    "mcafee_epo_push_agent_domain_name": null,
    "mcafee_epo_flatten_tree_structure": false,
    "mcafee_epo_allow_duplicates": false,
    "mcafee_epo_delete_if_removed": false,
    "mcafee_epo_push_agent_username": null,
    "mcafee_epo_uninstall": false,
    "mcafee_epo_push_agent_skip_if_installed": false,
    "mcafee_epo_system_name_or_id": "richard test1",
    "mcafee_epo_push_agent_suppress_ui": false,
    "mcafee_epo_push_agent_password": null
  },
  "metrics": {
    "version": "1.0",
    "package": "fn-mcafee-epo",
    "package_version": "3.0.0",
    "host": "local",
    "execution_time_ms": 787,
    "timestamp": "2023-10-09 10:26:00"
  }
}