{
  "version": 2.0,
  "success": true,
  "reason": null,
  "content": true,
  "raw": null,
  "inputs": {
    "mcafee_epo_username": "new user",
    "mcafee_epo_permsetname": "Global Reviewer"
  },
  "metrics": {
    "version": "1.0",
    "package": "fn-mcafee-epo",
    "package_version": "3.0.0",
    "host": "local",
    "execution_time_ms": 625,
    "timestamp": "2023-10-09 13:17:32"
  }
}