{
  "version": 2.0,
  "success": true,
  "reason": null,
  "content": true,
  "raw": null,
  "inputs": {
    "mcafee_epo_product_id": "EPOAGENTMETA",
    "mcafee_epo_group_id": 3,
    "mcafee_epo_object_id": 4
  },
  "metrics": {
    "version": "1.0",
    "package": "fn-mcafee-epo",
    "package_version": "3.0.0",
    "host": "local",
    "execution_time_ms": 702,
    "timestamp": "2023-10-09 13:20:24"
  }
}